{
    "system": "eu-eci",
    "petition_id": "ECI(2024)000007",
    "title": "Stop Destroying Videogames",
    "status": "ANSWERED",
    "registration_date": "2024-06-19",
    "collection_start_date": "2024-07-31",
    "closed_date": "2025-07-31",
    "submitted_date": "2026-01-26",
    "answered_date": "2026-06-16",
    "total_supporters": 1294188,
    "support_link": "https://eci.ec.europa.eu/045/public/?lg=en",
    "organizer_names": [
        "Daniel ONDRUSKA",
        "Aleksej VJALICIN"
    ],
    "organizer_roles": [
        "REPRESENTATIVE",
        "SUBSTITUTE"
    ],
    "organizer_countries": [
        "de",
        ""
    ],
    "funding_total_eur": 0,
    "funding_sponsor_count": 1,
    "registration_decision_celex": "32024D1824",
    "answer_refs": [
        "C(2026)4110"
    ],
    "latest_update": "2026-06-16",
    "title_lang": "en",
    "objectives": "Require publishers that sell or license videogames to consumers in the European Union (or related features and assets sold for videogames they operate) to leave said videogames in a working (playable) state.",
    "versions": {
        "en": {
            "title": "Stop Destroying Videogames",
            "objectives": "Require publishers ...",
            "support_link": "https://eci.ec.europa.eu/045/public/?lg=en"
        },
        "fr": {
            "title": "Stop à la destruction des jeux vidéo",
            "objectives": "Obliger les éditeurs ..."
        }
    },
    "categories": [
        "JUST",
        "TRADE"
    ],
    "register_id": 7834,
    "register_url": "https://citizens-initiative.europa.eu/initiatives/details/2024/000007_en",
    "verified_supporters": 1294188,
    "verified_countries": [
        "DE",
        "FR"
    ],
    "verified_counts": [
        229472,
        95817
    ],
    "verified_after_submission": [
        false,
        false
    ],
    "representative_country": "de",
    "answer_communication_url": "https://ec.europa.eu/transparency/documents-register/detail?ref=C(2026)4110"
}
